{"code_version":"sha256:49d0e9604a507af35c6670deca2b538d62cabb8695abf62378bc831cc90de7ad","config_hash":"sha256:e9f912bea561086217ae24dd9790d5e55da7765924941cab5f4f75923b8f463b","config_id":"fx-min","deterministic_replay_sha256":"sha256:bde1994e88cb38846aaf827c450199bdc346c7f8c31201b17006dcb641ab505e","fixtures_only":true,"gate_results":{},"goodput_results":[{"baselines":[{"causal_score_total":0,"completed":2,"completion_p50_us":2000,"completion_p95_us":2000,"deadline_hits":0,"deadline_misses":0,"dispatched_to_phone":0,"evictions":0,"fell_back_to_server":2,"is_diagnostic_losing":false,"is_upper_bound":false,"policy":"server_only","prepare_us_total":0,"server_gpu_us_freed":0,"server_gpu_us_used":4000,"transfer_bytes":0,"waited_for_weights":0,"weight_misses":0}],"goodput_bytes_per_s":104857600}],"inputs":[{"path":"fixtures/valid/sim_config.valid.json","role":"sim_config","sha256":"sha256:440866c30d8c4b7cc551b13637ab91988dc7e840f1ee11237bf4545cecbbbcfc"}],"kind":"residency_sim","run_id":"run-fx","schema_version":1,"seed":1}
